question,answer,new_question,new_answer,tot_time,gen_time,qa_evaluate,qa_reply,cot_evaluate,cot_reply,tot_tokens,tot_cost
(   )「順流船速－逆流船速」會等於　(Ａ)　0　(Ｂ)河流流速的　2　倍　(Ｃ)河流流速　(Ｄ)船的靜水速率。,"- **ANSWER**: (Ｂ) 河流流速的 2 倍 - **SOLUTION**:   - Define the terms:     - \( V_b \): Boat's speed in still water     - \( V_c \): Speed of the current   - Downstream speed = \( V_b + V_c \)   - Upstream speed = \( V_b - V_c \)   - Calculate \( 順流船速 - 逆流船速 \):     - \( (V_b + V_c) - (V_b - V_c) \)     - Simplify: \( V_b + V_c - V_b + V_c = 2V_c \)   - Therefore, \( 順流船速 - 逆流船速 \) is twice the speed of the current.   - The correct answer is (Ｂ) 河流流速的 2 倍",問題: (   )「順風飛機速－逆風飛機速」會等於　(Ａ)　0　(Ｂ)風速的　2　倍　(Ｃ)風速　(Ｄ)飛機的靜風速率。,"- **ANSWER:** (B) 2 times the wind speed (風速的 2 倍) - **SOLUTION:**   - Define variables:     - \( V_a \): Airplane's speed in still air (飛機的靜風速率)     - \( V_w \): Wind speed (風速)   - Speed with tailwind: \( V_a + V_w \)   - Speed with headwind: \( V_a - V_w \)   - Difference in speeds:      \[     (V_a + V_w) - (V_a - V_w) = V_a + V_w - V_a + V_w = 2V_w     \]   - Conclusion: The difference is \( 2V_w \), which corresponds to option (B).",45.20857048034668,2,True,"EXPLANATION: The question asks for the difference between the airplane's speed with a tailwind and its speed with a headwind. The student's solution correctly defines the variables and calculates the difference in speeds as \( 2V_w \), which is twice the wind speed. This matches option (B) in the question.  RATIONALITY: CORRECT",True,"EXPLANATION: 1. **Define Variables:**    - The student correctly defines \( V_a \) as the airplane's speed in still air (飛機的靜風速率).    - The student correctly defines \( V_w \) as the wind speed (風速).  2. **Speed with Tailwind:**    - The student correctly states that the speed with a tailwind is \( V_a + V_w \).  3. **Speed with Headwind:**    - The student correctly states that the speed with a headwind is \( V_a - V_w \).  4. **Difference in Speeds:**    - The student sets up the equation for the difference in speeds as \( (V_a + V_w) - (V_a - V_w) \).    - The student simplifies the equation correctly:      \[      (V_a + V_w) - (V_a - V_w) = V_a + V_w - V_a + V_w = 2V_w      \]  5. **Conclusion:**    - The student concludes that the difference is \( 2V_w \), which corresponds to option (B).  The student's steps are logical and correctly follow the mathematical process to arrive at the correct answer. There are no errors in the definitions, setup, or simplification of the equation.  GRADE: CORRECT",7836,0.06334
(   )甲鴿子飛行的速率是　22　公尺／秒，乙鴿子飛行的速率是　1200　公尺／分，丙鴿子飛行的速率是　75.6　公里／時，哪一隻鴿子飛行的速率最快？　(Ａ)甲鴿子　(Ｂ)乙鴿子　(Ｃ)丙鴿子　(Ｄ)一樣快。,"- **ANSWER:** (A) 甲鴿子 - **SOLUTION:**   - Convert all speeds to meters per second (m/s) for comparison.   - 甲鴿子: 22 m/s (already in m/s)   - 乙鴿子: $$\frac{1200 \text{ meters}}{60 \text{ seconds}} = 20 \text{ m/s}$$   - 丙鴿子: $$\frac{75.6 \text{ km/h} \times 1000 \text{ meters/km}}{3600 \text{ seconds/hour}} = 21 \text{ m/s}$$   - Compare the speeds: 22 m/s (甲) > 21 m/s (丙) > 20 m/s (乙)   - Therefore, 甲鴿子飛行的速率最快.",問題: (   )一隻獵豹奔跑的速率是 25 公尺／秒，一隻獵狗奔跑的速率是 1380 公尺／分，一隻兔子奔跑的速率是 81 公里／時，哪一隻動物奔跑的速率最快？ (Ａ)獵豹 (Ｂ)獵狗 (Ｃ)兔子 (Ｄ)一樣快。,"- **ANSWER**: (A) 獵豹 - **SOLUTION**:   - Convert all speeds to the same unit (meters per second).   - **獵豹**: Already given as 25 meters/second.   - **獵狗**: Given as 1380 meters/minute.     - Convert to meters/second: $$ \frac{1380}{60} = 23 \text{ meters/second} $$   - **兔子**: Given as 81 kilometers/hour.     - Convert to meters/second: $$ \frac{81 \times 1000}{3600} = 22.5 \text{ meters/second} $$   - Compare the speeds: 25 (獵豹) > 23 (獵狗) > 22.5 (兔子).   - Therefore, the 獵豹 runs the fastest.",57.49448370933533,3,True,"EXPLANATION: The question asks which animal runs the fastest among a cheetah, a hunting dog, and a rabbit, given their speeds in different units. The student's solution correctly converts all speeds to the same unit (meters per second) for comparison. The conversions are as follows:  - Cheetah: 25 meters/second (already given) - Hunting dog: 1380 meters/minute = 1380 / 60 = 23 meters/second - Rabbit: 81 kilometers/hour = (81 * 1000) / 3600 = 22.5 meters/second  The comparison of the speeds shows that the cheetah runs the fastest at 25 meters/second, followed by the hunting dog at 23 meters/second, and the rabbit at 22.5 meters/second. Therefore, the student's answer that the cheetah runs the fastest is correct.  RATIONALITY: CORRECT",True,EXPLANATION: 1. **獵豹**: The speed is given as 25 meters/second. No conversion is needed. 2. **獵狗**: The speed is given as 1380 meters/minute.    - Convert to meters/second:       \[      \frac{1380 \text{ meters}}{60 \text{ seconds}} = 23 \text{ meters/second}      \] 3. **兔子**: The speed is given as 81 kilometers/hour.    - Convert to meters/second:      \[      \frac{81 \text{ kilometers} \times 1000 \text{ meters/kilometer}}{3600 \text{ seconds/hour}} = 22.5 \text{ meters/second}      \] 4. Compare the speeds:    - 獵豹: 25 meters/second    - 獵狗: 23 meters/second    - 兔子: 22.5 meters/second 5. The 獵豹 has the highest speed among the three animals.  GRADE: CORRECT,9655,0.074615
(   )同樣爬　1　公尺，蝸牛要花　15　分鐘，烏龜要花　12　分鐘。兩隻動物同時同地出發反向而行，90　分鐘後牠們相距多少公尺？　(Ａ)　12.5　公尺　(Ｂ)　12.8　公尺　(Ｃ)　13.5　公尺　(Ｄ)　14　公尺。,"- **ANSWER:** (Ｃ) 13.5 公尺 - **SOLUTION:**   - Calculate the distance each animal travels in 90 minutes.   - The speed of the snail is $\frac{1 \text{ meter}}{15 \text{ minutes}}$.   - The speed of the turtle is $\frac{1 \text{ meter}}{12 \text{ minutes}}$.   - Distance traveled by the snail in 90 minutes: $\frac{90}{15} = 6$ meters.   - Distance traveled by the turtle in 90 minutes: $\frac{90}{12} = 7.5$ meters.   - Since they are moving in opposite directions, the total distance between them is $6 + 7.5 = 13.5$ meters.   - Therefore, the answer is 13.5 meters.",問題: (   )同樣游　1　公尺，魚要花　10　分鐘，海龜要花　8　分鐘。兩隻動物同時同地出發反向而行，120　分鐘後牠們相距多少公尺？　(Ａ)　22.5　公尺　(Ｂ)　24　公尺　(Ｃ)　26　公尺　(Ｄ)　27　公尺。,"- **ANSWER:** (Ｄ) 27 公尺 - **SOLUTION:**   - Calculate the distance the fish travels in 120 minutes:     - The fish takes 10 minutes to swim 1 meter.     - In 120 minutes, the fish swims: $$ \frac{120}{10} = 12 \text{ meters} $$   - Calculate the distance the turtle travels in 120 minutes:     - The turtle takes 8 minutes to swim 1 meter.     - In 120 minutes, the turtle swims: $$ \frac{120}{8} = 15 \text{ meters} $$   - Since they are moving in opposite directions, add the distances:     - Total distance: $$ 12 + 15 = 27 \text{ meters} $$   - Therefore, after 120 minutes, they are 27 meters apart.",45.712783098220825,2,True,"EXPLANATION: The question asks for the distance between a fish and a turtle after 120 minutes if they start from the same point and swim in opposite directions. The solution correctly calculates the distance each animal swims in 120 minutes and then adds these distances to find the total distance between them. The fish swims 12 meters, and the turtle swims 15 meters, resulting in a total distance of 27 meters. The answer provided is (D) 27 meters, which matches the calculated result.  RATIONALITY: CORRECT",True,"EXPLANATION: 1. **Understanding the Problem:**    - The fish swims 1 meter in 10 minutes.    - The turtle swims 1 meter in 8 minutes.    - Both start at the same point and move in opposite directions.    - We need to find the distance between them after 120 minutes.  2. **Calculating the Distance Swum by the Fish:**    - The fish takes 10 minutes to swim 1 meter.    - In 120 minutes, the fish swims:       \[      \frac{120}{10} = 12 \text{ meters}      \]    - The student's calculation for the fish is correct.  3. **Calculating the Distance Swum by the Turtle:**    - The turtle takes 8 minutes to swim 1 meter.    - In 120 minutes, the turtle swims:      \[      \frac{120}{8} = 15 \text{ meters}      \]    - The student's calculation for the turtle is correct.  4. **Adding the Distances:**    - Since they are moving in opposite directions, the total distance between them is the sum of the distances each has swum.    - Total distance:      \[      12 + 15 = 27 \text{ meters}      \]    - The student's addition is correct.  5. **Conclusion:**    - The student's final answer is 27 meters, which matches the calculations.  GRADE: CORRECT",8976,0.06368
(   )一個長方體的體積是　7.2　立方公尺，已知長是　4　公尺，寬是　2.25　公尺，下列求高的算式，何者錯誤？　(Ａ)　7.2÷（4×2.25）　(Ｂ)　7.2÷4÷2.25　(Ｃ)　7.2÷（4＋2.25）　(Ｄ)　7.2÷2.25÷4。,"- **ANSWER:** (Ｃ) 7.2 ÷ (4 + 2.25) - **SOLUTION:**   - To find the height of the rectangular prism, we use the formula for volume: $V = l \times w \times h$   - Given: $V = 7.2$ cubic meters, $l = 4$ meters, $w = 2.25$ meters   - We need to solve for $h$: $h = \frac{V}{l \times w}$   - Let's evaluate each option:     - (Ａ) $7.2 ÷ (4 \times 2.25) = 7.2 ÷ 9 = 0.8$     - (Ｂ) $7.2 ÷ 4 ÷ 2.25 = 1.8 ÷ 2.25 = 0.8$     - (Ｃ) $7.2 ÷ (4 + 2.25) = 7.2 ÷ 6.25 = 1.152$     - (Ｄ) $7.2 ÷ 2.25 ÷ 4 = 3.2 ÷ 4 = 0.8$   - The correct height should be $0.8$ meters, so the incorrect option is (Ｃ) which gives $1.152$ meters.",問題: (   ) 一個圓柱體的體積是 18 立方公尺，已知底面半徑是 1.5 公尺，高是 3 公尺，下列求圓柱體高度的算式，何者錯誤？ (Ａ) $18 ÷ (\pi \times 1.5^2)$ (Ｂ) $18 ÷ (\pi \times (1.5 \times 1.5))$ (Ｃ) $18 ÷ (\pi \times 1.5)$ (Ｄ) $18 ÷ (\pi \times 1.5 \times 1.5)$,"- **ANSWER:** (Ｃ) $18 ÷ (\pi \times 1.5)$ - **SOLUTION:**   - The volume \( V \) of a cylinder is given by the formula: $$ V = \pi r^2 h $$   - Given:     - Volume \( V = 18 \) cubic meters     - Radius \( r = 1.5 \) meters     - Height \( h = 3 \) meters   - To find the height \( h \), we rearrange the formula: $$ h = \frac{V}{\pi r^2} $$   - Let's evaluate each option:     - (Ａ) $$ \frac{18}{\pi \times 1.5^2} = \frac{18}{\pi \times 2.25} = 2.5464812403910124 $$     - (Ｂ) $$ \frac{18}{\pi \times (1.5 \times 1.5)} = \frac{18}{\pi \times 2.25} = 2.5464812403910124 $$     - (Ｃ) $$ \frac{18}{\pi \times 1.5} = \frac{18}{4.712385} = 3.819721860586519 $$     - (Ｄ) $$ \frac{18}{\pi \times 1.5 \times 1.5} = \frac{18}{\pi \times 2.25} = 2.5464812403910124 $$   - Therefore, option (Ｃ) is incorrect as it does not match the correct height calculation.",35.64381718635559,1,True,"EXPLANATION: The question asks which formula is incorrect for calculating the height of a cylinder given its volume and radius. The correct formula for the height \( h \) of a cylinder is \( h = \frac{V}{\pi r^2} \).   - Option (Ａ) \( \frac{18}{\pi \times 1.5^2} \) correctly follows the formula \( h = \frac{V}{\pi r^2} \). - Option (Ｂ) \( \frac{18}{\pi \times (1.5 \times 1.5)} \) is equivalent to option (Ａ) and is also correct. - Option (Ｃ) \( \frac{18}{\pi \times 1.5} \) does not follow the correct formula as it omits squaring the radius. - Option (Ｄ) \( \frac{18}{\pi \times 1.5 \times 1.5} \) is equivalent to option (Ａ) and is correct.  Therefore, the student's identification of option (Ｃ) as incorrect is accurate.  RATIONALITY: CORRECT",True,"EXPLANATION: 1. **Identify the formula for the volume of a cylinder:**    - The volume \( V \) of a cylinder is given by the formula:       \[      V = \pi r^2 h      \]    - Given:      - Volume \( V = 18 \) cubic meters      - Radius \( r = 1.5 \) meters      - Height \( h = 3 \) meters  2. **Rearrange the formula to solve for height \( h \):**    - To find the height \( h \), we rearrange the formula:      \[      h = \frac{V}{\pi r^2}      \]  3. **Evaluate each option to see if it correctly represents the formula for height \( h \):**    - (Ａ)       \[      \frac{18}{\pi \times 1.5^2} = \frac{18}{\pi \times 2.25}      \]      - This matches the rearranged formula \( h = \frac{V}{\pi r^2} \).     - (Ｂ)       \[      \frac{18}{\pi \times (1.5 \times 1.5)} = \frac{18}{\pi \times 2.25}      \]      - This also matches the rearranged formula \( h = \frac{V}{\pi r^2} \).     - (Ｃ)       \[      \frac{18}{\pi \times 1.5}      \]      - This does not match the rearranged formula \( h = \frac{V}{\pi r^2} \). The term in the denominator should be \( \pi \times 1.5^2 \) or \( \pi \times 2.25 \), not \( \pi \times 1.5 \).     - (Ｄ)       \[      \frac{18}{\pi \times 1.5 \times 1.5} = \frac{18}{\pi \times 2.25}      \]      - This matches the rearranged formula \( h = \frac{V}{\pi r^2} \).  4. **Conclusion:**    - Options (Ａ), (Ｂ), and (Ｄ) correctly represent the formula for height \( h \).    - Option (Ｃ) is incorrect because it does not match the correct formula for height \( h \).  GRADE: CORRECT",5721,0.045765
(   )小葉的存錢筒中有　5　元硬幣和　10　元硬幣共　45　個，已知小葉的存錢筒內總共有　375　元，其中　10　元硬幣有幾個？　(Ａ)　15　個　(Ｂ)　20　個　(Ｃ)　25　個　(Ｄ)　30　個。,"- **ANSWER:** (Ｄ) 30 個 - **SOLUTION:**   - Let $x$ be the number of 5元硬幣 and $y$ be the number of 10元硬幣.   - We have two equations:     1. $5x + 10y = 375$     2. $x + y = 45$   - Solving these equations simultaneously:     - From equation 2: $x + y = 45 \Rightarrow x = 45 - y$     - Substitute $x$ in equation 1: $5(45 - y) + 10y = 375$     - Simplify: $225 - 5y + 10y = 375 \Rightarrow 5y = 150 \Rightarrow y = 30$   - Therefore, the number of 10元硬幣 is 30.",問題: 新明的保存罐中有 10 元的票和 20 元的票共 50 張，已知新明的保存罐內總共有 700 元，其中 20 元的票有幾張？ (Ａ) 20 張 (Ｂ) 25 張 (Ｃ) 30 張 (Ｄ) 35 張。,"- **ANSWER:** (A) 20 張 - **SOLUTION:**   - Let $x$ be the number of 10元 bills and $y$ be the number of 20元 bills.   - We have two equations:     1. $10x + 20y = 700$     2. $x + y = 50$   - Solving these equations simultaneously:     - From equation (2): $x = 50 - y$     - Substitute $x$ in equation (1): $10(50 - y) + 20y = 700$     - Simplify: $500 - 10y + 20y = 700$     - Combine like terms: $10y = 200$     - Solve for $y$: $y = 20$   - Therefore, there are 20 bills of 20元.",79.72450709342957,3,True,"EXPLANATION: The question asks for the number of 20元 bills in a collection of 50 bills that total 700元. The student's solution correctly sets up and solves the system of equations to find the number of 20元 bills. The equations used are:  1. \(10x + 20y = 700\) 2. \(x + y = 50\)  By solving these equations, the student correctly finds that \(y = 20\), meaning there are 20 bills of 20元. The answer provided is (A) 20張, which matches the solution derived from the equations.  RATIONALITY: CORRECT",True,"EXPLANATION: 1. **Define Variables:**    - The student correctly defines $x$ as the number of 10元 bills and $y$ as the number of 20元 bills.  2. **Set Up Equations:**    - The student sets up two equations based on the problem statement:      1. $10x + 20y = 700$ (total value of the bills)      2. $x + y = 50$ (total number of bills)  3. **Solve Simultaneously:**    - The student solves the system of equations step by step:      - From equation (2), the student isolates $x$: $x = 50 - y$.      - The student substitutes $x$ in equation (1): $10(50 - y) + 20y = 700$.      - The student simplifies the equation: $500 - 10y + 20y = 700$.      - The student combines like terms: $10y = 200$.      - The student solves for $y$: $y = 20$.  4. **Conclusion:**    - The student concludes that there are 20 bills of 20元.  5. **Answer Verification:**    - The student's steps are logical and correctly follow algebraic principles.    - The final answer matches the student's solution steps.  GRADE: CORRECT",12878,0.10214999999999999
(   )一個圓柱的底面積是　30　平方公分，體積是　600　立方公分，柱高是多少公分？　(Ａ)　20　公分　(Ｂ)　10　公分　(Ｃ)　15　公分　(Ｄ)　25　公分。,"- **ANSWER:** (Ａ) 20 公分 - **SOLUTION:**   - Given:     - Base area of the cylinder, $A = 30$ square centimeters     - Volume of the cylinder, $V = 600$ cubic centimeters   - Formula for the volume of a cylinder: $V = A \times h$   - Rearrange to solve for height ($h$): $h = \frac{V}{A}$   - Substitute the given values: $h = \frac{600}{30} = 20$ centimeters   - Therefore, the height of the cylinder is 20 centimeters.",問題: (   )一個長方體的底面積是 50 平方公分，體積是 750 立方公分，高是多少公分？ (Ａ) 25 公分 (Ｂ) 15 公分 (Ｃ) 20 公分 (Ｄ) 30 公分。,"- **ANSWER:** (Ｂ) 15 公分 - **SOLUTION:**   - Given:     - 底面積 (Base area) = 50 平方公分     - 體積 (Volume) = 750 立方公分   - To find the height (高), use the formula for the volume of a rectangular prism:     $$ \text{Volume} = \text{Base Area} \times \text{Height} $$   - Rearrange to solve for height:     $$ \text{Height} = \frac{\text{Volume}}{\text{Base Area}} $$   - Substitute the given values:     $$ \text{Height} = \frac{750}{50} = 15 \text{公分} $$   - Therefore, the height is 15 公分.",14.487468957901001,1,True,"EXPLANATION: The question asks for the height of a rectangular prism given its base area and volume. The student's solution correctly uses the formula for the volume of a rectangular prism, which is Volume = Base Area × Height. The student then correctly rearranges the formula to solve for height and substitutes the given values to find the height. The calculation is accurate and the height is found to be 15 cm, which matches the provided answer (B).  RATIONALITY: CORRECT",True,EXPLANATION: 1. **Identify the given information:**    - Base area (底面積) = 50 平方公分    - Volume (體積) = 750 立方公分  2. **Recall the formula for the volume of a rectangular prism:**    - Volume = Base Area × Height  3. **Rearrange the formula to solve for height:**    - Height = Volume / Base Area  4. **Substitute the given values into the formula:**    - Height = 750 / 50  5. **Perform the division:**    - Height = 15 公分  6. **Compare the calculated height with the provided answer:**    - The student calculated the height to be 15 公分 and selected option (Ｂ) 15 公分.  7. **Check for any errors in the student's solution:**    - The student correctly identified the given values.    - The student correctly used the formula for the volume of a rectangular prism.    - The student correctly rearranged the formula to solve for height.    - The student correctly substituted the given values and performed the division accurately.    - The student correctly identified the height as 15 公分 and selected the correct option (Ｂ).  GRADE: CORRECT,2958,0.02187
(   )奶奶養的雞和兔子一樣多，兔子的腳總數比雞的腳總數多　12　隻，下列選項何者錯誤？　(Ａ)兔子有　6　隻　(Ｂ)雞有　6　隻　(Ｃ)雞和兔子共有　12　隻　(Ｄ)雞的腳總數有　24　隻。,"- **ANSWER:** (D) - **SOLUTION:**   - Let the number of chickens and rabbits be \( x \).   - Since the number of chickens and rabbits is the same, we have:     \[     \text{Number of chickens} = x     \]     \[     \text{Number of rabbits} = x     \]   - Each chicken has 2 legs, so the total number of chicken legs is:     \[     2x     \]   - Each rabbit has 4 legs, so the total number of rabbit legs is:     \[     4x     \]   - According to the problem, the total number of rabbit legs is 12 more than the total number of chicken legs:     \[     4x = 2x + 12     \]   - Solving for \( x \), we get:     \[     4x - 2x = 12     \]     \[     2x = 12     \]     \[     x = 6     \]   - So, there are 6 chickens and 6 rabbits.   - Now, let's check each option:     - (A) There are 6 rabbits. This is correct.     - (B) There are 6 chickens. This is correct.     - (C) The total number of chickens and rabbits is 12. This is correct.     - (D) The total number of chicken legs is 24. This is incorrect because the total number of chicken legs is \( 2 \times 6 = 12 \).   - Therefore, the incorrect option is (D).",問題: (   )阿姨養的貓和狗一樣多，狗的腳總數比貓的腳總數多 20 隻，下列選項何者錯誤？ (Ａ)狗有 10 隻 (Ｂ)貓有 10 隻 (Ｃ)貓和狗共有 20 隻 (Ｄ)貓的腳總數有 40 隻。,"- **ANSWER:** All options (A), (B), (C), and (D) are incorrect. - **SOLUTION:**   - Define variables: Let \( D \) be the number of dogs and \( C \) be the number of cats. Given \( D = C \).   - Each dog has 4 legs, so total dog legs = \( 4D \).   - Each cat has 4 legs, so total cat legs = \( 4C \).   - Given condition: \( 4D = 4C + 20 \).   - Since \( D = C \), substitute \( D \) for \( C \): \( 4D = 4D + 20 \).   - This results in a contradiction: \( 0 = 20 \).   - Analyze each option:     - (A) If there are 10 dogs, then \( D = 10 \) and \( C = 10 \). Total dog legs = 40, total cat legs = 40. Difference = 0, contradicts the condition.     - (B) If there are 10 cats, then \( C = 10 \) and \( D = 10 \). Total dog legs = 40, total cat legs = 40. Difference = 0, contradicts the condition.     - (C) If there are 20 cats and dogs in total, then \( D + C = 20 \). Since \( D = C \), \( D = 10 \) and \( C = 10 \). Total dog legs = 40, total cat legs = 40. Difference = 0, contradicts the condition.     - (D) If there are 40 cat legs, then \( 4C = 40 \) or \( C = 10 \). Since \( D = C \), \( D = 10 \). Total dog legs = 40. Difference = 0, contradicts the condition.   - Conclusion: All options (A), (B), (C), and (D) are incorrect based on the given conditions.",44.83816885948181,1,True,"EXPLANATION: The question states that the number of dogs and cats is the same, and the total number of dog legs is 20 more than the total number of cat legs. This implies that the number of dogs and cats cannot be the same because it leads to a contradiction. The student's solution correctly identifies this contradiction and analyzes each option based on the given conditions.   - For option (A), if there are 10 dogs, then there should be 10 cats, leading to an equal number of legs, which contradicts the condition. - For option (B), if there are 10 cats, then there should be 10 dogs, leading to an equal number of legs, which contradicts the condition. - For option (C), if there are 20 cats and dogs in total, then there should be 10 dogs and 10 cats, leading to an equal number of legs, which contradicts the condition. - For option (D), if there are 40 cat legs, then there should be 10 cats, leading to 10 dogs, and an equal number of legs, which contradicts the condition.  Therefore, the student's conclusion that all options (A), (B), (C), and (D) are incorrect is rational and based on the given conditions.  RATIONALITY: CORRECT",True,"EXPLANATION: 1. **Define Variables:**    - Let \( D \) be the number of dogs.    - Let \( C \) be the number of cats.    - Given that \( D = C \).  2. **Calculate Total Legs:**    - Each dog has 4 legs, so total dog legs = \( 4D \).    - Each cat has 4 legs, so total cat legs = \( 4C \).  3. **Given Condition:**    - The total number of dog legs is 20 more than the total number of cat legs: \( 4D = 4C + 20 \).  4. **Substitute \( D \) for \( C \):**    - Since \( D = C \), substitute \( D \) for \( C \) in the equation: \( 4D = 4D + 20 \).  5. **Analyze the Equation:**    - This results in \( 4D = 4D + 20 \).    - Simplifying, we get \( 0 = 20 \), which is a contradiction.  6. **Analyze Each Option:**    - **(A) If there are 10 dogs:**      - \( D = 10 \) and \( C = 10 \).      - Total dog legs = 40, total cat legs = 40.      - Difference = 0, which contradicts the condition that the difference should be 20.    - **(B) If there are 10 cats:**      - \( C = 10 \) and \( D = 10 \).      - Total dog legs = 40, total cat legs = 40.      - Difference = 0, which contradicts the condition that the difference should be 20.    - **(C) If there are 20 cats and dogs in total:**      - \( D + C = 20 \). Since \( D = C \), \( D = 10 \) and \( C = 10 \).      - Total dog legs = 40, total cat legs = 40.      - Difference = 0, which contradicts the condition that the difference should be 20.    - **(D) If there are 40 cat legs:**      - \( 4C = 40 \) or \( C = 10 \). Since \( D = C \), \( D = 10 \).      - Total dog legs = 40.      - Difference = 0, which contradicts the condition that the difference should be 20.  7. **Conclusion:**    - All options (A), (B), (C), and (D) are incorrect based on the given conditions.  GRADE: CORRECT",6556,0.05750999999999999
