question,answer,new_question,new_answer,tot_time,gen_time,qa_evaluate,qa_reply,cot_evaluate,cot_reply,tot_tokens,tot_cost
(   )灰姑娘洗了　3　個碗，還有　2　個碗沒洗，她一共要洗幾個碗？下面哪一個算式是對的？　(Ａ)　4＋5＝9　(Ｂ)　1＋7＝8　(Ｃ)　3＋2＝5。,"- **ANSWER:** (Ｃ) 3＋2＝5 - **SOLUTION:**   - Cinderella washed 3 bowls and there are 2 bowls left unwashed.   - To find the total number of bowls, add the washed bowls to the unwashed bowls.   - The equation is $3 + 2 = 5$.   - Therefore, the correct option is (Ｃ) 3＋2＝5.",問題: (   )小紅涂了2幅畫，還有4幅畫沒涂，她一共要涂幾幅畫？下面哪一個算式是對的？(Ａ) $3 + 3 = 6$ (Ｂ) $4 + 1 = 5$ (Ｃ) $2 + 4 = 6$,- **ANSWER:** (Ｃ) $2 + 4 = 6$ - **SOLUTION:**   - Identify the given information:     - 小紅 has already painted 2 paintings.     - 小紅 has 4 paintings left to paint.   - Formulate the total number of paintings:     - Total paintings = Paintings already painted + Paintings left to paint     - Total paintings = $2 + 4$   - Calculate the total number of paintings:     - Total paintings = $6$   - Evaluate the given equations to find the correct one:     - (Ａ) $3 + 3 = 6$     - (Ｂ) $4 + 1 = 5$     - (Ｃ) $2 + 4 = 6$   - Compare the total number of paintings with the equations:     - The total number of paintings is $6$.     - Equation (Ａ) $3 + 3 = 6$ is correct.     - Equation (Ｂ) $4 + 1 = 5$ is incorrect.     - Equation (Ｃ) $2 + 4 = 6$ is correct.   - The correct equation that matches the total number of paintings is (Ｃ) $2 + 4 = 6$.,29.506136655807495,1,True,"EXPLANATION: The question asks for the total number of paintings 小紅 needs to paint, given that she has already painted 2 and has 4 left to paint. The correct equation to represent this is $2 + 4 = 6$. The student's answer and solution correctly identify the total number of paintings as 6 and correctly select the equation (Ｃ) $2 + 4 = 6$ as the correct one. The solution also correctly evaluates the other given equations and finds that only (Ｃ) matches the total number of paintings.  RATIONALITY: CORRECT",True,EXPLANATION: 1. **Identify the given information:**    - 小紅 has already painted 2 paintings.    - 小紅 has 4 paintings left to paint.  2. **Formulate the total number of paintings:**    - Total paintings = Paintings already painted + Paintings left to paint    - Total paintings = $2 + 4$  3. **Calculate the total number of paintings:**    - Total paintings = $6$  4. **Evaluate the given equations to find the correct one:**    - (Ａ) $3 + 3 = 6$    - (Ｂ) $4 + 1 = 5$    - (Ｃ) $2 + 4 = 6$  5. **Compare the total number of paintings with the equations:**    - The total number of paintings is $6$.    - Equation (Ａ) $3 + 3 = 6$ is correct.    - Equation (Ｂ) $4 + 1 = 5$ is incorrect.    - Equation (Ｃ) $2 + 4 = 6$ is correct.  6. **Conclusion:**    - The correct equation that matches the total number of paintings is (Ｃ) $2 + 4 = 6$.  GRADE: CORRECT,3951,0.031655
(   )5　隻鴨子在玩水，又來了　4　隻，全部有幾隻鴨子？ (Ａ)　9　隻　(Ｂ)　8　隻　(Ｃ)　7　隻。,"- **ANSWER:** 9 隻 - **SOLUTION:**   - Start with the initial number of ducks: 5 隻   - Add the number of ducks that came later: 4 隻   - Calculate the total number of ducks: $5 + 4 = 9$   - Therefore, the total number of ducks is 9 隻",問題: (   ) 7 架飛機在天上飛，又來了 3 架，全部有幾架飛機？ (Ａ) 10 架 (Ｂ) 9 架 (Ｃ) 8 架,- **ANSWER:** (Ａ) 10 架 - **SOLUTION:**   - Step 1: Identify the initial number of planes: 7 架   - Step 2: Add the incoming planes: 7 + 3   - Step 3: Calculate the total: $$7 + 3 = 10$$   - Final Answer: 10 架,16.855222940444946,1,True,"EXPLANATION: The question asks for the total number of planes when 7 planes are initially in the sky and 3 more planes arrive. The student's answer and solution correctly identify the initial number of planes, add the incoming planes, and calculate the total number of planes. The final answer of 10 planes is rational and matches the given options.  RATIONALITY: CORRECT",True,"EXPLANATION: 1. **Step 1: Identify the initial number of planes: 7 架**    - The student correctly identifies that there are initially 7 planes.  2. **Step 2: Add the incoming planes: 7 + 3**    - The student correctly adds the incoming 3 planes to the initial 7 planes.  3. **Step 3: Calculate the total: 7 + 3 = 10**    - The student correctly calculates the sum of 7 and 3 to be 10.  4. **Final Answer: 10 架**    - The student concludes that the total number of planes is 10, which matches the correct answer choice (Ａ) 10 架.  GRADE: CORRECT",2389,0.016515000000000002
(   )媽媽先烤　2　個蛋糕，再烤　3　個蛋糕，媽媽總共烤了幾個蛋糕？ (Ａ)　4　個　(Ｂ)　5　個　(Ｃ)　6　個。,- **ANSWER:** (Ｂ) 5 個 - **SOLUTION:**   - Step 1: Identify the number of cakes baked in each instance.     - First instance: 2 cakes     - Second instance: 3 cakes   - Step 2: Add the number of cakes baked in each instance.     - $$2 + 3 = 5$$   - Final Answer: 5 cakes,問題: (   )小明先畫了 4 隻貓，再畫了 6 隻貓，小明總共畫了幾隻貓？ (Ａ) 8 隻 (Ｂ) 10 隻 (Ｃ) 12 隻。,- **ANSWER:** (Ｂ) 10 隻 - **SOLUTION:**   - Step 1: 小明先畫了 4 隻貓。   - Step 2: 再畫了 6 隻貓。   - Step 3: 總共畫的貓數量為 $4 + 6$。   - Step 4: 計算 $4 + 6 = 10$。   - 最終答案是 10 隻貓。,14.245361804962158,1,True,"EXPLANATION: The question asks how many cats Xiaoming drew in total after drawing 4 cats first and then 6 more cats. The student's answer and solution correctly add the two quantities (4 and 6) to get the total number of cats drawn, which is 10. The answer provided is (Ｂ) 10 隻, which matches the correct calculation.  RATIONALITY: CORRECT",True,"EXPLANATION: 1. **Step 1:** The student correctly identifies that 小明 first drew 4 cats. 2. **Step 2:** The student correctly identifies that 小明 then drew 6 more cats. 3. **Step 3:** The student correctly sets up the equation to find the total number of cats by adding the two quantities: $4 + 6$. 4. **Step 4:** The student correctly calculates the sum of $4 + 6$ to be 10. 5. **Final Answer:** The student concludes that the total number of cats is 10, which matches the correct answer choice (Ｂ) 10 隻.  GRADE: CORRECT",2536,0.01766
(   )下面哪兩個數合起來是　10　？　(Ａ)　4　和　5　(Ｂ)　6　和　1　(Ｃ)　8　和　2。,"- **ANSWER:** (C) 8 and 2 - **SOLUTION:**   - Evaluate each pair of numbers to see which sums to 10.   - **Option (A):** \( 4 + 5 = 9 \) (not equal to 10)   - **Option (B):** \( 6 + 1 = 7 \) (not equal to 10)   - **Option (C):** \( 8 + 2 = 10 \) (equal to 10)   - Therefore, the correct pair is (C) 8 and 2.",問題: (   ) 下列哪兩個數合起來是 15？ (Ａ) 7 和 5 (Ｂ) 9 和 6 (Ｃ) 11 和 4。,"- **ANSWER:** (B) 9 and 6, (C) 11 and 4 - **SOLUTION:**   - Evaluate each pair of numbers to see if their sum is 15.   - For (A) 7 and 5:     - Calculation: \( 7 + 5 = 12 \)     - Result: 12 (not equal to 15)   - For (B) 9 and 6:     - Calculation: \( 9 + 6 = 15 \)     - Result: 15 (equal to 15)   - For (C) 11 and 4:     - Calculation: \( 11 + 4 = 15 \)     - Result: 15 (equal to 15)   - Both (B) and (C) add up to 15.",26.489460468292236,1,True,"EXPLANATION: The question asks for ""which two numbers add up to 15"" and provides three options. The student correctly identifies that both (B) 9 and 6, and (C) 11 and 4, add up to 15. The solution provided by the student correctly evaluates each pair of numbers and shows the calculations that lead to the conclusion.   However, the question seems to imply that only one pair should be chosen, as it uses the word ""哪兩個數"" (which two numbers) in a singular form. The student provided two correct pairs, which technically answers the question but may not align with the implied expectation of selecting only one pair.  RATIONALITY: CORRECT",True,"EXPLANATION: 1. **Understand the Question:**    - The question asks which two numbers add up to 15.    - There are three options provided: (A) 7 and 5, (B) 9 and 6, (C) 11 and 4.  2. **Evaluate Each Option:**    - **Option (A):**       - Calculation: \( 7 + 5 \)      - Result: \( 7 + 5 = 12 \)      - Conclusion: 12 is not equal to 15, so (A) is incorrect.    - **Option (B):**      - Calculation: \( 9 + 6 \)      - Result: \( 9 + 6 = 15 \)      - Conclusion: 15 is equal to 15, so (B) is correct.    - **Option (C):**      - Calculation: \( 11 + 4 \)      - Result: \( 11 + 4 = 15 \)      - Conclusion: 15 is equal to 15, so (C) is correct.  3. **Check Student's Answer:**    - The student answered (B) 9 and 6, (C) 11 and 4.    - The student provided calculations for each option and correctly identified that both (B) and (C) add up to 15.  4. **Verify the Student's Solution:**    - The student correctly evaluated each pair of numbers.    - The student correctly identified that (A) does not add up to 15.    - The student correctly identified that both (B) and (C) add up to 15.  GRADE: CORRECT",3240,0.02624
(   )做下面哪一件事花的時間最長？　(Ａ)吃一碗飯　(Ｂ)喝一杯豆漿　(Ｃ)看一部電影。,- **ANSWER:** (C) 看一部電影 (Watching a movie) - **SOLUTION:**   - Consider the typical duration for each activity:     - Eating a bowl of rice: 10 to 20 minutes     - Drinking a cup of soy milk: 5 to 10 minutes     - Watching a movie: 1.5 to 2.5 hours   - Compare the durations:     - Eating a bowl of rice: 10 to 20 minutes     - Drinking a cup of soy milk: 5 to 10 minutes     - Watching a movie: 1.5 to 2.5 hours   - Watching a movie takes the longest time.   - **Final Answer:** (C) 看一部電影 (Watching a movie),問題: (   )做下面哪一件事花的時間最長？　(Ａ)煮一鍋湯　(Ｂ)寫一封信　(Ｃ)讀一本書。,"- **ANSWER:** (Ｃ)讀一本書 - **SOLUTION:**   - To determine which activity takes the longest time, we need to consider the typical duration for each task:     - (Ａ)煮一鍋湯 (Cooking a pot of soup): This usually takes about 30 minutes to 1 hour.     - (Ｂ)寫一封信 (Writing a letter): This typically takes about 10 to 30 minutes.     - (Ｃ)讀一本書 (Reading a book): This can take several hours to days, depending on the length of the book.   - Comparing the durations:     - Cooking a pot of soup: 30 minutes to 1 hour.     - Writing a letter: 10 to 30 minutes.     - Reading a book: several hours to days.   - Therefore, reading a book takes the longest time.   - Final answer: (Ｃ)讀一本書",14.765860319137573,1,True,EXPLANATION: The student's answer and solution are rational. The student correctly identifies that reading a book generally takes longer than cooking a pot of soup or writing a letter. The typical durations provided for each activity are reasonable and align with common experiences. The comparison of the durations is logical and leads to the correct conclusion that reading a book takes the longest time.  RATIONALITY: CORRECT,True,"EXPLANATION: 1. **Identify the Question:** The question asks which activity takes the longest time among cooking a pot of soup, writing a letter, and reading a book. 2. **Review the Student's Answer:** The student answered (Ｃ)讀一本書 (Reading a book). 3. **Analyze the Student's Solution:**    - The student breaks down the typical duration for each task:      - (Ａ)煮一鍋湯 (Cooking a pot of soup): 30 minutes to 1 hour.      - (Ｂ)寫一封信 (Writing a letter): 10 to 30 minutes.      - (Ｃ)讀一本書 (Reading a book): several hours to days.    - The student then compares these durations:      - Cooking a pot of soup: 30 minutes to 1 hour.      - Writing a letter: 10 to 30 minutes.      - Reading a book: several hours to days.    - The student concludes that reading a book takes the longest time. 4. **Check for Logical Consistency:** The student's breakdown of the durations is reasonable and logically consistent. The comparison clearly shows that reading a book takes significantly longer than the other two activities. 5. **Final Answer Verification:** The student's final answer (Ｃ)讀一本書 is supported by their logical reasoning and comparison of durations.  GRADE: CORRECT",2231,0.017535
(   )小紅帽要去外婆家，下面哪一件事情會最後發生？　(Ａ)從家裡出發　(Ｂ)帶著花到達外婆家　(Ｃ)在路上採了花。,"- **ANSWER:** (Ｂ) 帶著花到達外婆家 - **SOLUTION:**   - Identify the events:     - (A) 從家裡出發 (Leaving home)     - (B) 帶著花到達外婆家 (Arriving at grandmother's house with flowers)     - (C) 在路上採了花 (Picking flowers on the way)   - Sequence the events logically:     - First, 小紅帽 must leave home to start her journey. Therefore, (A) 從家裡出發 happens first.     - While on the way to her grandmother's house, she picks flowers. Therefore, (C) 在路上採了花 happens after she leaves home but before she arrives at her destination.     - Finally, she arrives at her grandmother's house with the flowers she picked. Therefore, (B) 帶著花到達外婆家 happens last.   - Conclusion:     - The event that happens last is (B) 帶著花到達外婆家.",問題: (   )小明要去圖書館，下面哪一件事情會最後發生？　(Ａ)從家裡出發　(Ｂ)借了書離開圖書館　(Ｃ)在路上遇到朋友。,"- **ANSWER**: (B) 借了書離開圖書館 - **SOLUTION**:   - **Step 1**: 小明 needs to leave home to go to the library (從家裡出發).   - **Step 2**: On the way to the library, 小明 might meet a friend (在路上遇到朋友).   - **Step 3**: After arriving at the library, 小明 will borrow a book and then leave the library (借了書離開圖書館).   - Therefore, the last event to happen is borrowing a book and leaving the library.",20.47913956642151,1,True,"EXPLANATION: The question asks which event will happen last as 小明 goes to the library. The provided answer and solution logically sequence the events: leaving home, possibly meeting a friend on the way, and finally borrowing a book and leaving the library. The sequence is rational and follows a logical order of events.  RATIONALITY: CORRECT",True,"EXPLANATION: 1. **Step 1**: The student correctly identifies that 小明 needs to leave home to go to the library (從家裡出發). This is logically the first step in the sequence. 2. **Step 2**: The student correctly identifies that on the way to the library, 小明 might meet a friend (在路上遇到朋友). This event would logically occur after leaving home but before arriving at the library. 3. **Step 3**: The student correctly identifies that after arriving at the library, 小明 will borrow a book and then leave the library (借了書離開圖書館). This event would logically occur after the previous two steps.  The student has correctly sequenced the events in the order they would logically occur, and has correctly identified that the last event to happen is borrowing a book and leaving the library.  GRADE: CORRECT",3059,0.022615
(   )小美原有　9　顆糖果，分給姐姐　7　顆，小美還有幾顆糖果？　(Ａ)　2　顆　(Ｂ)　3　顆　(Ｃ)　4　顆。,- **ANSWER:** (A) 2 顆 - **SOLUTION:**   - 小美原有 9 顆糖果。   - 分給姐姐 7 顆。   - 剩下的糖果數量計算為 $9 - 7$。   - 計算結果為 2 顆。   - 因此，小美還有 2 顆糖果。,問題: (   )Tom原有15顆蘋果，分給朋友8顆，Tom還有幾顆蘋果？ (Ａ) 5顆 (Ｂ) 6顆 (Ｃ) 7顆。,- **ANSWER:** (Ｃ) 7顆 - **SOLUTION:**   - Tom原有15顆蘋果。   - 分給朋友8顆。   - 剩下的蘋果數量計算為：$$15 - 8 = 7$$   - 所以，Tom還有7顆蘋果。,17.502614736557007,1,True,"EXPLANATION: The question asks how many apples Tom has left after giving 8 apples to his friends from an initial total of 15 apples. The student's answer is (Ｃ) 7顆, and the solution provided shows the calculation \(15 - 8 = 7\). This calculation is correct and rational. The number of apples left is a positive integer, which makes sense in the context of the problem.  RATIONALITY: CORRECT",True,"EXPLANATION: 1. **Understanding the Problem:**    - The problem states that Tom originally had 15 apples and gave 8 apples to his friends. We need to determine how many apples Tom has left.  2. **Identifying the Key Information:**    - Tom originally had 15 apples.    - Tom gave away 8 apples.  3. **Setting Up the Equation:**    - To find out how many apples Tom has left, we need to subtract the number of apples he gave away from the number of apples he originally had.    - The equation to represent this situation is: \( 15 - 8 \).  4. **Solving the Equation:**    - The student correctly sets up the equation: \( 15 - 8 \).    - The student correctly calculates the result of the equation: \( 15 - 8 = 7 \).  5. **Choosing the Correct Answer:**    - The student identifies the correct answer choice as (Ｃ) 7顆.  6. **Verification:**    - The student's solution steps are logical and correctly follow the problem's requirements.    - The subtraction operation is performed correctly.    - The final answer matches the correct choice provided in the options.  GRADE: CORRECT",2548,0.018609999999999998
(   )下面哪一個算式的答案和其他兩個不一樣？　(Ａ)　2＋6　(Ｂ)　6＋3　(Ｃ)　4＋4。,"- **ANSWER:** (Ｂ) 6＋3 - **SOLUTION:**   - Calculate each expression:     - $2 + 6 = 8$     - $6 + 3 = 9$     - $4 + 4 = 8$   - The results are 8, 9, and 8 respectively.   - The expression $6 + 3$ yields a different result (9) compared to the other two expressions (8).",問題: (   )下面哪一個算式的答案和其他兩個不一樣？　(Ａ)　$3＋2$　(Ｂ)　$5＋4$　(Ｃ)　$1＋4$,"- **ANSWER:** (Ｂ) $5＋4$ - **SOLUTION:**   - Calculate each expression:     - (Ａ) $3＋2 = 5$     - (Ｂ) $5＋4 = 9$     - (Ｃ) $1＋4 = 5$   - Compare the results:     - Both (Ａ) and (Ｃ) result in $5$     - (Ｂ) results in $9$   - Therefore, the answer is (Ｂ) $5＋4$ as it is different from the other two.",23.17383885383606,1,True,"QUESTION: 問題: (   )下面哪一個算式的答案和其他兩個不一樣？　(Ａ)　$3＋2$　(Ｂ)　$5＋4$　(Ｃ)　$1＋4$ ANSWER AND SOLUTION:  - **ANSWER:** (Ｂ) $5＋4$ - **SOLUTION:**    - Calculate each expression:     - (Ａ) $3＋2 = 5$     - (Ｂ) $5＋4 = 9$     - (Ｃ) $1＋4 = 5$   - Compare the results:     - Both (Ａ) and (Ｃ) result in $5$     - (Ｂ) results in $9$   - Therefore, the answer is (Ｂ) $5＋4$ as it is different from the other two. EXPLANATION: The student correctly calculated the results of each expression and identified that (Ｂ) $5＋4$ is different from the other two, which both result in $5$. RATIONALITY: CORRECT",True,"EXPLANATION: 1. **Identify the question:** The question asks which of the given expressions has a different result compared to the other two. 2. **List the expressions:**     - (Ａ) $3＋2$    - (Ｂ) $5＋4$    - (Ｃ) $1＋4$ 3. **Calculate each expression:**    - (Ａ) $3＋2 = 5$    - (Ｂ) $5＋4 = 9$    - (Ｃ) $1＋4 = 5$ 4. **Compare the results:**    - Both (Ａ) and (Ｃ) result in $5$    - (Ｂ) results in $9$ 5. **Determine which expression is different:** Since (Ａ) and (Ｃ) both result in $5$, and (Ｂ) results in $9$, (Ｂ) is the expression with a different result. 6. **Check the student's answer and solution:** The student correctly calculated each expression and correctly identified that (Ｂ) $5＋4$ is different from the other two.  GRADE: CORRECT",3287,0.024485
(   )冰箱裡有　15　瓶果汁和　9　瓶牛奶，哪一種比較少？　(Ａ)果汁　(Ｂ)牛奶　(Ｃ)一樣多。,"- **ANSWER:** (B) Milk - **SOLUTION:**   - Identify the number of bottles of juice: 15   - Identify the number of bottles of milk: 9   - Compare the two quantities:     - 15 (juice) is greater than 9 (milk)   - Therefore, milk is the one with fewer bottles.",問題: (   )冰箱裡有 22 條香腸和 18 個雞蛋，哪一種比較少？ (Ａ)香腸 (Ｂ)雞蛋 (Ｃ)一樣多。,- **ANSWER**: (Ｂ)雞蛋 - **SOLUTION**:   - Identify the quantities of each item:     - 香腸 (sausages): 22     - 雞蛋 (eggs): 18   - Compare the quantities:     - $22 > 18$   - Determine which quantity is smaller:     - 18 is less than 22.   - Final Answer: (Ｂ) 雞蛋 (eggs),18.383891820907593,1,True,"EXPLANATION: The question asks which item is fewer in quantity between sausages and eggs. The given quantities are 22 sausages and 18 eggs. The solution correctly identifies the quantities and compares them, concluding that 18 (eggs) is less than 22 (sausages). Therefore, the answer (B) eggs is correct.  RATIONALITY: CORRECT",True,"EXPLANATION: 1. **Identify the quantities of each item:**    - The student correctly identifies that there are 22 sausages and 18 eggs.  2. **Compare the quantities:**    - The student correctly compares the quantities by stating that 22 is greater than 18.  3. **Determine which quantity is smaller:**    - The student correctly concludes that 18 (eggs) is less than 22 (sausages).  4. **Final Answer:**    - The student correctly selects (Ｂ) 雞蛋 (eggs) as the item with the smaller quantity.  Since the student's steps are logical and correctly lead to the conclusion that eggs are fewer than sausages, the answer is correct.  GRADE: CORRECT",2556,0.01864
(   )做下面哪一件事花的時間最短？　(Ａ)下課休息時間玩遊戲　(Ｂ)午睡　(Ｃ)晚上睡覺。,"- **ANSWER:** (Ａ)下課休息時間玩遊戲 - **SOLUTION:**   - To determine which activity takes the shortest amount of time, we compare the typical durations of each activity:     - (Ａ) 下課休息時間玩遊戲 (Playing games during break time): Typically, a school break lasts around 10-15 minutes.     - (Ｂ) 午睡 (Taking a nap): A nap usually lasts around 30 minutes to 1 hour.     - (Ｃ) 晚上睡覺 (Sleeping at night): Night sleep typically lasts around 7-8 hours.   - Comparing these durations, it is clear that playing games during break time takes the shortest amount of time.   - Therefore, the answer is (Ａ)下課休息時間玩遊戲.",問題: (   ) 做下面哪一件事花的時間最短？　(Ａ)煮一頓飯　(Ｂ)看一部電影　(Ｃ)上班一天。,"- **ANSWER**: (Ａ)煮一頓飯 - **SOLUTION**:   - To determine which activity takes the shortest time, we need to estimate the typical duration for each activity:     - (Ａ) 煮一頓飯 (Cooking a meal): Typically takes about 30 minutes to 1 hour.     - (Ｂ) 看一部電影 (Watching a movie): Typically takes about 1.5 to 2 hours.     - (Ｃ) 上班一天 (Working a full day): Typically takes about 8 hours.   - Comparing the durations:     - Cooking a meal: 30 minutes to 1 hour     - Watching a movie: 1.5 to 2 hours     - Working a full day: 8 hours   - The shortest duration is for cooking a meal.   - Therefore, the answer is (Ａ) 煮一頓飯.",17.921252012252808,1,True,"EXPLANATION: The question asks which activity takes the shortest time among cooking a meal, watching a movie, and working a full day. The student's solution provides a reasonable estimation of the typical durations for each activity:  - Cooking a meal: 30 minutes to 1 hour - Watching a movie: 1.5 to 2 hours - Working a full day: 8 hours  Based on these estimations, cooking a meal indeed takes the shortest time. The student's answer and solution are rational and factually accurate.  RATIONALITY: CORRECT",True,"EXPLANATION: 1. **Understanding the Question**: The question asks which activity takes the shortest amount of time among cooking a meal, watching a movie, and working a full day. 2. **Identifying the Activities and Their Durations**:    - (Ａ) 煮一頓飯 (Cooking a meal): The student estimates this takes about 30 minutes to 1 hour.    - (Ｂ) 看一部電影 (Watching a movie): The student estimates this takes about 1.5 to 2 hours.    - (Ｃ) 上班一天 (Working a full day): The student estimates this takes about 8 hours. 3. **Comparing the Durations**:    - Cooking a meal: 30 minutes to 1 hour    - Watching a movie: 1.5 to 2 hours    - Working a full day: 8 hours 4. **Determining the Shortest Duration**: The student correctly identifies that cooking a meal (30 minutes to 1 hour) is shorter than watching a movie (1.5 to 2 hours) and working a full day (8 hours). 5. **Conclusion**: The student concludes that the activity that takes the shortest time is cooking a meal.  GRADE: CORRECT",2248,0.01777
