question,answer,new_question,new_answer,tot_time,gen_time,qa_evaluate,qa_reply,cot_evaluate,cot_reply,tot_tokens,tot_cost
(   )小欣媽媽買了　46　元的綠豆和　32　元的砂糖，她一共花了多少元？　(Ａ)　83　元　(Ｂ)　78　元　(Ｃ)　73　元。,- **ANSWER:** (B) 78 元 - **SOLUTION:**   - Step 1: Add the cost of the green beans and the sugar.   - Step 2: $46 + 32 = 78$   - Final Answer: 78 元,問題: (   )小美爸爸買了 58 元的西瓜和 27 元的蘋果，他一共花了多少元？ (Ａ) 85 元 (Ｂ) 87 元 (Ｃ) 95 元。,"- **ANSWER:** (Ａ) 85 元 - **SOLUTION:**   - Step 1: Add the cost of the watermelon and the apples.   - Step 2: Calculate $58 + 27$.   - Step 3: The sum is $85$.   - Therefore, 小美's dad spent a total of $85$ 元.",38.057241678237915,3,True,"EXPLANATION: The question asks for the total amount of money spent by 小美's dad on a watermelon and apples, which cost 58 元 and 27 元 respectively. The student's answer and solution involve adding these two amounts together to get the total cost. The calculation $58 + 27 = 85$ is correct. The answer provided is (Ａ) 85 元, which matches the correct total.  RATIONALITY: CORRECT",True,"EXPLANATION: 1. **Step 1:** The student correctly identifies that they need to add the cost of the watermelon and the apples. 2. **Step 2:** The student sets up the addition problem correctly as $58 + 27$. 3. **Step 3:** The student calculates the sum as $85$.  The student's steps are logical and correctly follow the process of solving the problem. The addition is set up correctly, and the final sum is calculated accurately.  GRADE: CORRECT",6940,0.04744999999999999
(   )小有　54　張貼紙，送給妹妹　13　張，小還有幾張貼紙？　(Ａ)　21　張　(Ｂ)　31　張　(Ｃ)　41　張。,"- **ANSWER:** 41 - **SOLUTION:**   - Start with the total number of stickers 小 has: 54.   - Subtract the number of stickers given to 妹妹: 13.   - The calculation is: $$54 - 13 = 41$$.   - Therefore, 小 still has 41 stickers.",問題: (   )小有 73 本書，送給朋友 28 本，小還有幾本書？ (Ａ) 35 本 (Ｂ) 45 本 (Ｃ) 55 本。,"- **ANSWER:** (Ｂ) 45 本 - **SOLUTION:**   - Step 1: Start with the total number of books 小有, which is 73.   - Step 2: Subtract the number of books given to friends, which is 28.   - Step 3: Perform the calculation: $$73 - 28 = 45$$   - Final Answer: 小還有 45 本書.",12.28171992301941,1,True,"EXPLANATION: The question asks how many books are left after giving away 28 books from a total of 73 books. The student's solution involves subtracting 28 from 73, which is a rational and logical approach to solving the problem. The calculation performed is correct: \(73 - 28 = 45\). Therefore, the answer provided is 45 books, which matches option (B).  RATIONALITY: CORRECT",True,"EXPLANATION: 1. **Step 1:** The student correctly identifies the total number of books 小有, which is 73. 2. **Step 2:** The student correctly identifies the number of books given to friends, which is 28. 3. **Step 3:** The student performs the subtraction operation: \( 73 - 28 \). 4. **Step 4:** The student correctly calculates \( 73 - 28 = 45 \). 5. **Final Answer:** The student concludes that 小還有 45 本書, which matches the correct answer choice (Ｂ) 45 本.  The student's steps are logical and correctly follow the problem's requirements. The calculation is accurate, and the final answer is correctly identified.  GRADE: CORRECT",2373,0.016555
(   )小均摺了　92　隻紙青蛙，送給弟弟　21　隻，還剩下幾隻紙青蛙？　(Ａ)　81　隻　(Ｂ)　77　隻　(Ｃ)　71　隻。,"- **ANSWER**: (C) 71 隻 - **SOLUTION**:   - Step 1: Start with the total number of paper frogs 小均摺了, which is 92.   - Step 2: Subtract the number of paper frogs given to the弟弟, which is 21.   - Step 3: Perform the calculation: $92 - 21 = 71$   - Final Answer: 71 paper frogs are left.","問題: 聰明摺了 150 枝紙箭，送給朋友 45 枝，還剩下幾枝紙箭？ 
(A) 115 枝 (B) 105 枝 (C) 95 枝","- **ANSWER:** (B) 105 枝 - **SOLUTION:**   - Step 1: Start with the total number of paper arrows 聰明摺了, which is 150.   - Step 2: Subtract the number of paper arrows given to friends, which is 45.   - Step 3: Perform the calculation: $$150 - 45 = 105$$   - Final Answer: 105 枝 paper arrows are left.",17.51795768737793,1,True,EXPLANATION: The question asks how many paper arrows are left after giving away a certain number. The student correctly identifies the total number of paper arrows (150) and the number given away (45). The subtraction performed (150 - 45) is accurate and results in 105. The answer provided (B) 105 枝 is correct based on the calculation.  RATIONALITY: CORRECT,True,"EXPLANATION: 1. **Step 1:** The student correctly identifies the total number of paper arrows 聰明摺了, which is 150. 2. **Step 2:** The student correctly identifies the number of paper arrows given to friends, which is 45. 3. **Step 3:** The student performs the subtraction operation: \(150 - 45\). 4. **Step 4:** The student correctly calculates the result of the subtraction as 105. 5. **Final Answer:** The student concludes that 105 paper arrows are left.  The student's steps are logical and correctly follow the problem's requirements. The calculation is accurate, and the final answer matches the correct choice.  GRADE: CORRECT",2478,0.017119999999999996
(   )昨天哥哥早餐花了　58　元，午餐花了　85　元，晚餐花了　99　元，哥哥昨天三餐哪一餐花了最多錢？　(Ａ)早餐　(Ｂ)午餐　(Ｃ)晚餐。,"- **ANSWER:** (Ｃ)晚餐 - **SOLUTION:**   - Compare the amounts spent on each meal:     - Breakfast: 58 元     - Lunch: 85 元     - Dinner: 99 元   - Determine which amount is the highest:     - 99 元 (Dinner) is greater than 85 元 (Lunch) and 58 元 (Breakfast).   - Therefore, the meal with the highest cost is dinner.",問題: (   )昨天妹妹買書花了 120 元，買鉛筆花了 70 元，買筆記本花了 45 元，妹妹昨天買哪一樣東西花了最多錢？ (Ａ)書 (Ｂ)鉛筆 (Ｃ)筆記本。,"- **ANSWER**: (Ａ) 書 (book) - **SOLUTION**:   - Given the expenditures:     - 書 (book): 120 元     - 鉛筆 (pencil): 70 元     - 筆記本 (notebook): 45 元   - Compare the expenditures:     - 120 元 (book) > 70 元 (pencil)     - 120 元 (book) > 45 元 (notebook)   - Therefore, the item with the highest expenditure is 書 (book).",18.92256450653076,1,True,"EXPLANATION: The question asks which item the sister spent the most money on yesterday, providing the costs for a book, pencil, and notebook. The student's answer and solution correctly identify that the book, costing 120 元, is the most expensive item compared to the pencil (70 元) and the notebook (45 元). The comparison of the expenditures is accurate and logical.  RATIONALITY: CORRECT",True,"EXPLANATION: 1. **Identify the expenditures for each item:**    - 書 (book): 120 元    - 鉛筆 (pencil): 70 元    - 筆記本 (notebook): 45 元  2. **Compare the expenditures:**    - Compare 書 (book) and 鉛筆 (pencil):      - 120 元 (book) > 70 元 (pencil)    - Compare 書 (book) and 筆記本 (notebook):      - 120 元 (book) > 45 元 (notebook)  3. **Determine the item with the highest expenditure:**    - Since 120 元 (book) is greater than both 70 元 (pencil) and 45 元 (notebook), the item with the highest expenditure is 書 (book).  4. **Conclusion:**    - The student's answer and solution correctly identify 書 (book) as the item with the highest expenditure.  GRADE: CORRECT",3161,0.024485
(   )依照數的順序，5　個一數，80—85—90—95—□，□應該是　(Ａ)　98　(Ｂ)　99　(Ｃ)　100。,"- **ANSWER:** (Ｃ) 100 - **SOLUTION:**   - The sequence given is 80, 85, 90, 95, □.   - Each number in the sequence increases by 5.   - To find the next number after 95, add 5 to 95.   - $$95 + 5 = 100$$   - Therefore, the number that should fill the blank is 100.",問題: (   )依照數的順序，8個一數，64—72—80—88—□，□應該是 (Ａ) 95 (Ｂ) 96 (Ｃ) 97,"- **ANSWER:** (B) 96 - **SOLUTION:**   - Identify the pattern: Each number in the sequence increases by 8.     - $72 - 64 = 8$     - $80 - 72 = 8$     - $88 - 80 = 8$   - Apply the pattern to the last number in the sequence:     - Last number in the sequence: 88     - Add 8 to the last number: $88 + 8$   - Perform the calculation:     - $88 + 8 = 96$   - Therefore, the next number in the sequence is 96.",18.80109453201294,1,True,"EXPLANATION: The question asks for the next number in a sequence where each number increases by 8. The given sequence is 64, 72, 80, 88. The student correctly identifies the pattern of adding 8 to each number. By adding 8 to the last number in the sequence (88), the student correctly calculates the next number as 96. The answer provided is (B) 96, which matches the calculated result.  RATIONALITY: CORRECT",True,EXPLANATION: 1. **Identify the pattern:**    - The student correctly identifies that each number in the sequence increases by 8.    - They verify this by showing the differences between consecutive numbers:      - $72 - 64 = 8$      - $80 - 72 = 8$      - $88 - 80 = 8$    - This confirms that the pattern is an increment of 8.  2. **Apply the pattern to the last number in the sequence:**    - The student correctly identifies the last number in the given sequence as 88.    - They then add 8 to this last number to find the next number in the sequence:      - $88 + 8$  3. **Perform the calculation:**    - The student correctly performs the addition:      - $88 + 8 = 96$  4. **Conclusion:**    - The student concludes that the next number in the sequence is 96.    - They select option (B) 96 as the correct answer.  GRADE: CORRECT,2914,0.02229
(   )下面哪一個算式的答案不是　7？　(Ａ)　16－9　(Ｂ)　15－9　(Ｃ)　14－7。,- **ANSWER:** (Ｂ) 15－9 - **SOLUTION:**   - Calculate each option:     - (Ａ) $16 - 9 = 7$     - (Ｂ) $15 - 9 = 6$     - (Ｃ) $14 - 7 = 7$   - The only option that does not equal 7 is (Ｂ) $15 - 9 = 6$.,問題: (   )下面哪一個算式的答案不是 8？ (Ａ) 20－12 (Ｂ) 18－10 (Ｃ) 16－8。,"- **ANSWER**: None of the given options - **SOLUTION**:   - Calculate each expression:     - (Ａ) $20 - 12 = 8$     - (Ｂ) $18 - 10 = 8$     - (Ｃ) $16 - 8 = 8$   - All the given expressions result in 8. Therefore, none of the options have an answer that is not 8.",18.82949733734131,1,True,"EXPLANATION: The question asks which of the given expressions does not result in 8. The student correctly calculates each expression and finds that all of them equal 8. Therefore, the student's answer that none of the given options have an answer that is not 8 is correct.  RATIONALITY: CORRECT",True,"EXPLANATION: 1. The question asks which of the given expressions does not result in 8. 2. The student needs to evaluate each expression to determine if it equals 8 or not. 3. Let's check each expression step by step:    - For (Ａ) $20 - 12$:       - Subtract 12 from 20.      - Result: $20 - 12 = 8$.    - For (Ｂ) $18 - 10$:       - Subtract 10 from 18.      - Result: $18 - 10 = 8$.    - For (Ｃ) $16 - 8$:       - Subtract 8 from 16.      - Result: $16 - 8 = 8$. 4. The student correctly calculated each expression and found that all of them result in 8. 5. Since all expressions result in 8, the student's conclusion that none of the options have an answer that is not 8 is correct.  GRADE: CORRECT",2939,0.020495
(   )琪琪買了一個　38　元的三明治和一瓶　31　元的牛奶當早餐，共花了多少元？　(Ａ)　69　元　(Ｂ)　74　元　(Ｃ)　79　元。,- **ANSWER:** (A) 69 元 - **SOLUTION:**   - Step 1: Identify the cost of the sandwich and the milk.     - Sandwich: 38 元     - Milk: 31 元   - Step 2: Add the costs together.     - $$38 + 31 = 69$$   - Final Answer: 69 元,問題: (   )小明買了一隻 45 元的鉛筆盒和一把 29 元的尺子，共花了多少元？ (Ａ) 72 元 (Ｂ) 74 元 (Ｃ) 79 元。,- **ANSWER:** (Ｂ) 74 元 - **SOLUTION:**   - Step 1: Identify the cost of the pencil case: 45 元   - Step 2: Identify the cost of the ruler: 29 元   - Step 3: Add the two amounts together: $$45 + 29 = 74$$   - Final Answer: 74 元,12.593998670578003,1,True,"EXPLANATION: The question asks for the total cost of a pencil case and a ruler, which are priced at 45 元 and 29 元 respectively. The student's solution correctly identifies the costs and adds them together to get 74 元. The answer provided is (Ｂ) 74 元, which matches the calculated total.  RATIONALITY: CORRECT",True,EXPLANATION: 1. **Step 1:** The student correctly identifies the cost of the pencil case as 45 元. 2. **Step 2:** The student correctly identifies the cost of the ruler as 29 元. 3. **Step 3:** The student correctly adds the two amounts together: 45 + 29 = 74. 4. **Final Answer:** The student concludes that the total cost is 74 元.  The student's steps are logical and correctly follow the process of solving the problem. Each step is accurate and leads to the correct final answer.  GRADE: CORRECT,2366,0.01611
(   )書桌上有　10　本名人傳記和　6　本科學小百科，書桌上一共有幾本書？　(Ａ)　15　本　(Ｂ)　16　本　(Ｃ)　17　本。,- **ANSWER:** (Ｂ) 16 本 - **SOLUTION:**   - Step 1: Identify the number of 名人傳記 (biographies) which is 10.   - Step 2: Identify the number of 科學小百科 (science encyclopedias) which is 6.   - Step 3: Add the two quantities together: $$10 + 6 = 16$$   - Final Answer: 16 本,問題: 書桌上有 8 本童話故事和 5 本漫畫書，書桌上一共有幾本書？ (Ａ) 12 本 (Ｂ) 13 本 (Ｃ) 14 本,- **ANSWER**: (Ｂ) 13 本 - **SOLUTION**:   - Step 1: Identify the number of 童話故事 (fairy tale books) which is 8.   - Step 2: Identify the number of 漫畫書 (comic books) which is 5.   - Step 3: Add the two quantities together: $8 + 5 = 13$.   - Final Answer: There are 13 books in total.,11.94888973236084,1,True,"EXPLANATION: The question asks for the total number of books on the desk, given that there are 8 fairy tale books and 5 comic books. The student's solution correctly identifies the quantities of each type of book and correctly adds them together to get a total of 13 books. The answer provided is (Ｂ) 13 本, which matches the correct total calculated in the solution.  RATIONALITY: CORRECT",True,EXPLANATION: 1. **Step 1**: The student correctly identifies the number of 童話故事 (fairy tale books) as 8. 2. **Step 2**: The student correctly identifies the number of 漫畫書 (comic books) as 5. 3. **Step 3**: The student correctly adds the two quantities together: $8 + 5 = 13$. 4. **Final Answer**: The student concludes that there are 13 books in total.  The student's steps are logical and correctly follow the process of solving the problem. Each step is accurate and leads to the correct final answer.  GRADE: CORRECT,2420,0.01668
(   )從高雄搭火車到屏東，搭乘自強號的票價是　48　元，搭乘區間車的票價是　31　元，兩種票價相差多少元？　(Ａ)　14　元　(Ｂ)　17　元　(Ｃ)　20　元。,"- **ANSWER:** (Ｂ) 17 元 - **SOLUTION:**   - To find the difference in ticket prices, subtract the price of the區間車 ticket from the price of the自強號 ticket.   - Equation: $$48 - 31 = 17$$   - Therefore, the two ticket prices differ by 17 元.",問題: 新竹搭巴士到台中，搭乘快車的票價是 60 元，搭乘慢車的票價是 45 元，兩種票價相差多少元？ (Ａ) 10 元 (Ｂ) 15 元 (Ｃ) 20 元。,- **ANSWER:** (Ｂ) 15 元 - **SOLUTION:**   - Step 1: Identify the ticket prices for the fast bus and the slow bus.     - Fast bus ticket price: 60 元     - Slow bus ticket price: 45 元   - Step 2: Calculate the difference between the two ticket prices.     - $$60 - 45 = 15$$   - Final Answer: The difference in ticket prices is 15 元.,13.517679691314697,1,True,"EXPLANATION: The question asks for the difference in ticket prices between a fast bus and a slow bus from Hsinchu to Taichung. The fast bus ticket costs 60 元 and the slow bus ticket costs 45 元. The student's solution correctly identifies the ticket prices and calculates the difference as 15 元. The answer provided is (Ｂ) 15 元, which matches the calculated difference.  RATIONALITY: CORRECT",True,"EXPLANATION: 1. **Step 1: Identify the ticket prices for the fast bus and the slow bus.**    - The student correctly identifies the fast bus ticket price as 60 元 and the slow bus ticket price as 45 元.  2. **Step 2: Calculate the difference between the two ticket prices.**    - The student correctly calculates the difference between the two ticket prices using the equation \(60 - 45 = 15\).  3. **Final Answer:**    - The student concludes that the difference in ticket prices is 15 元, which matches the calculation.  Since the student correctly identifies the ticket prices and accurately calculates the difference, their solution is correct.  GRADE: CORRECT",2524,0.0176
(   )文具店裡，一包快樂包　66　元，一包驚喜包　77　元，一包驚喜包比一包快樂包貴幾元？　(Ａ)　9　元　(Ｂ)　10　元　(Ｃ)　11　元。,- **ANSWER:** (Ｃ) 11 元 - **SOLUTION:**   - Step 1: Identify the prices of the two packages.     - 快樂包: 66 元     - 驚喜包: 77 元   - Step 2: Calculate the difference in price between the 驚喜包 and the 快樂包.     - Equation: $$77 - 66$$   - Step 3: Perform the subtraction.     - Result: 11 元   - Final Answer: The 驚喜包 is 11 元 more expensive than the 快樂包.,問題: 新問題: (   )超市裡，一袋米 45 元，一盒麵包 60 元，一盒麵包比一袋米貴幾元？ (Ａ) 13 元 (Ｂ) 15 元 (Ｃ) 20 元。,- **ANSWER:** (Ｂ) 15 元 - **SOLUTION:**   - Step 1: Identify the price of one bag of rice: 45 元.   - Step 2: Identify the price of one box of bread: 60 元.   - Step 3: Calculate the difference in price: $60 - 45 = 15$ 元.   - Final Answer: The box of bread is 15 元 more expensive than the bag of rice.,14.923091888427734,1,True,"EXPLANATION: The question asks for the difference in price between a box of bread and a bag of rice. The prices are given as 45 元 for the rice and 60 元 for the bread. The student's solution correctly identifies the prices and calculates the difference as 15 元. The answer provided is (Ｂ) 15 元, which matches the calculated difference.  RATIONALITY: CORRECT",True,"EXPLANATION: 1. **Step 1:** The student correctly identifies the price of one bag of rice as 45 元. 2. **Step 2:** The student correctly identifies the price of one box of bread as 60 元. 3. **Step 3:** The student calculates the difference in price by subtracting the price of the rice from the price of the bread: $60 - 45 = 15$ 元. This calculation is correct. 4. **Final Answer:** The student concludes that the box of bread is 15 元 more expensive than the bag of rice, which matches the correct answer choice (Ｂ) 15 元.  GRADE: CORRECT",2552,0.01761
